{
  "id": "real-vs-nominal",
  "he": "ריאלי או נומינלי",
  "one_line": "האם המס מחושב רק על הרווח שמעבר לעליית המדד, או על כל הרווח בשקלים",
  "source": {
    "url": "docs/product.md#33-dimension-checklist-or-what-you-are-not-considering",
    "title": "product.md 3.3 and glossary.md section 2",
    "publisher": "project",
    "strength": "primary",
    "checked": "2026-10-23"
  },
  "rule_ids": [
    "BANK-14",
    "BANK-25",
    "BANK-26",
    "BANK-28",
    "BANK-34",
    "CS-03",
    "CS-10",
    "CS-28",
    "GOV-03",
    "GOV-06",
    "GOV-08",
    "GOV-11",
    "GOV-12",
    "GOV-13",
    "GOV-14",
    "GOV-15",
    "GOV-19",
    "INS-26",
    "KGL-02",
    "KGL-24",
    "MF-37",
    "PEN-18",
    "PEN-27",
    "REG-21",
    "TX2-18",
    "TXA-28",
    "TXF-03",
    "TXF-04",
    "TXG-12",
    "TXG-13",
    "TXH-11",
    "TXI-03",
    "TXI-04",
    "TXI-05",
    "TXI-12",
    "TXI-14",
    "TXI-15",
    "TXI-25",
    "TXK-06",
    "TXK-07",
    "TXK-23",
    "TXP-27",
    "TXS-02",
    "TXS-03",
    "TXS-04",
    "TXS-09",
    "TXS-11",
    "TXS-12",
    "TXS-14",
    "TXS-22"
  ]
}
