{
  "id": "fee-trade",
  "he": "עמלת קנייה ומכירה",
  "one_line": "עמלה שנגבית בכל קנייה או מכירה של נייר ערך או של יחידות בקרן",
  "source": {
    "url": "docs/product.md#33-dimension-checklist-or-what-you-are-not-considering",
    "title": "product.md 3.3 and glossary.md section 2",
    "publisher": "project",
    "strength": "primary",
    "checked": "2026-10-23"
  },
  "rule_ids": [
    "BANK-18",
    "BANK-32",
    "BRK-15",
    "BRK-16",
    "BRK-19",
    "BRK-24",
    "BRK-33",
    "BRK-36",
    "BRK-37",
    "BRK-38",
    "ETF-05",
    "ETF-06",
    "ETF-13",
    "ETF-29",
    "GOV-20",
    "GOV-21",
    "IRA-16",
    "IRA-18",
    "IRA-21",
    "MF-26",
    "MF-27",
    "PF-10",
    "SW-24",
    "TX2-17"
  ]
}
