{
  "id": "fee-deposit",
  "he": "דמי ניהול מהפקדה",
  "one_line": "אחוז שנגבה מכל סכום שמפקידים, עוד לפני שהכסף מושקע",
  "source": {
    "url": "docs/product.md#33-dimension-checklist-or-what-you-are-not-considering",
    "title": "product.md 3.3 and glossary.md section 2",
    "publisher": "project",
    "strength": "primary",
    "checked": "2026-10-23"
  },
  "rule_ids": [
    "BANK-17",
    "CAT-06",
    "CAT-35",
    "CAT-36",
    "CAT-37",
    "CAT-38",
    "CAT-39",
    "CS-18",
    "INS-25",
    "KGL-14",
    "KGL-16",
    "KH-22",
    "MF-21",
    "PEN-10",
    "PEN-21",
    "PEN-22",
    "PEN-23",
    "PEN-35",
    "PF-01",
    "PF-02",
    "PF-03",
    "PF-04",
    "PF-05",
    "PF-06",
    "PF-34",
    "PF-35",
    "PF-36",
    "PF-38",
    "PF-39"
  ]
}
