{
  "id": "deposit-ceiling",
  "he": "תקרת הפקדה",
  "one_line": "האם יש סכום מרבי להפקדה, או סכום שמעליו ההטבה במס כבר לא חלה",
  "source": {
    "url": "docs/product.md#33-dimension-checklist-or-what-you-are-not-considering",
    "title": "product.md 3.3 and glossary.md section 2",
    "publisher": "project",
    "strength": "primary",
    "checked": "2026-10-23"
  },
  "rule_ids": [
    "BANK-27",
    "BANK-28",
    "CS-02",
    "CS-03",
    "CS-04",
    "IRA-07",
    "IRA-08",
    "IRA-27",
    "KGL-02",
    "KGL-03",
    "KGL-04",
    "KGL-24",
    "KH-04",
    "KH-05",
    "KH-07",
    "KH-08",
    "PEN-03",
    "PEN-04",
    "PEN-07",
    "PEN-08",
    "PEN-09",
    "PEN-10",
    "PEN-36",
    "TXH-01",
    "TXH-02",
    "TXH-03",
    "TXH-05",
    "TXH-08",
    "TXH-11",
    "TXH-22",
    "TXP-02",
    "TXP-03",
    "TXP-04",
    "TXP-05",
    "TXP-06",
    "TXP-10",
    "TXP-11",
    "TXP-27"
  ]
}
